company_id,description,formatted_experience_level,formatted_work_type,industries,job_function,job_id,location,title,work_type
71904349,"Job Opportunity for Medical Assistant

Job Description:

The back office Medical Assistant will room patients, verify conditions and medications, enter data into the EMR, and turnover rooms.















Actalent is a global leader in engineering and sciences services and talent solutions. We help visionary companies advance their engineering and science initiatives through access to specialized experts who drive scale, innovation and speed to market. With a network of almost 30,000 consultants and more than 4,500 clients across the U.S., Canada, Asia and Europe, Actalent serves many of the Fortune 500.



At Actalent, diversity and inclusion are a bridge towards the equity and success of our people. DE&I are embedded into our culture through:



The company is an equal opportunity employer and will consider all applications without regard to race, sex, age, color, religion, national origin, veteran status, disability, sexual orientation, gender identity, genetic information or any characteristic protected by law.

If you would like to request a reasonable accommodation, such as the modification or adjustment of the job application process or interviewing process due to a disability, please email actalentaccommodation@actalentservices.com for other accommodation options.",Entry level,Full-time,Business Consulting and Services,Health Care Provider,3878730129,"Titusville, FL",Hiring Medical Assistants With Pay $18+/hr With Added Benefits,FULL-TIME
90947088,"Data Scientist - Remote, USA

About RTeams:
RTeams is a groundbreaking technology company dedicated to leveraging data science and artificial intelligence to revolutionize how businesses operate and make decisions. With a commitment to innovation and excellence, we provide advanced analytics solutions that transform complex data into actionable insights. As we continue to grow, we are looking for a talented Data Scientist to join our dynamic team. This full-time, remote position is available to candidates throughout the United States, offering flexible working hours between 9-5pm or 10-6pm. RTeams offers the option for both contract and regular employment, aiming to find the ideal fit for our team and the successful candidate.

Your Role:

Key Responsibilities:

Technical Requirements:

Experience:

Who You Are:

Join Us:",Entry level,Full-time,Software Development,Engineering and Information Technology,3876226811,United States,Data Scientist,FULL-TIME
71904349,"Are you an Architectural Designer in Raleigh, North Carolina looking to work with a top company in the Triangle? Apply right here!

Description:

The candidate will assist with the production of architectural drawings and will partner with a more experienced project architect to develop plans, elevations, RCPs and details. With their vision and expertise, the candidate will model spaces, usually working off redlines or getting direction in a meeting.







Experience in Healthcare, Education, and S&T sectors



Entry Level (3-5 years)



Actalent is a global leader in engineering and sciences services and talent solutions. We help visionary companies advance their engineering and science initiatives through access to specialized experts who drive scale, innovation and speed to market. With a network of almost 30,000 consultants and more than 4,500 clients across the U.S., Canada, Asia and Europe, Actalent serves many of the Fortune 500.



At Actalent, diversity and inclusion are a bridge towards the equity and success of our people. DE&I are embedded into our culture through:



The company is an equal opportunity employer and will consider all applications without regard to race, sex, age, color, religion, national origin, veteran status, disability, sexual orientation, gender identity, genetic information or any characteristic protected by law.

If you would like to request a reasonable accommodation, such as the modification or adjustment of the job application process or interviewing process due to a disability, please email actalentaccommodation@actalentservices.com for other accommodation options.",Entry level,Full-time,Business Consulting and Services,"Design, Art/Creative, and Information Technology",3878721991,"Raleigh, NC",Architectural Designer,FULL-TIME
3664118,"Job Description

Brand Identity, Packaging, and Layout

Movetic is looking to bring on a Graphic Designer to join our growing hyper-creative collective. The ideal candidate is passionate about creating full-scale brands, in print and online. We are looking for someone with extensive experience in custom logo suite design, packaging design, layout design, and complete identity development, with multiple diverse full-scale brand identity case studies in their portfolio. Web design experience is a strong bonus.

We are looking for someone who can work hand in hand with our executive creative director, core leadership, other creatives, and strategists on the team to craft exciting full-scale brands from the ground up.

In addition to identity experience, we are looking for a candidate who can show high skill in print or web layout work. (Anything from brochures, magazines, web pages, decks, etc.)

This position will also be helping with internal design deliverables, including social media assets, case studies, and marketing materials. Having web design experience or interest is a bonus, as the role will involve some web design layout work. This role is fast-paced, self-sufficient, multifaceted, and exciting, with creative freedom and influence from various companies.









All interested candidates must submit a complete portfolio focusing on branding, packaging, and print design showcasing their process and thought. Please send your portfolio to hello@themovetic.com along with your resume. Looking forward to creating something great, together!!



Igniting the Ambitiously Bold

Built for progress, led by passion. We are a hyper-creative collective with multifaceted experience partnering exclusively with the ambitiously bold. We craft custom brands, websites, and content for companies who dare to be different.

Igniting the Ambitiously Bold Built for progress, led by passion. We are a hyper-creative collective with multifaceted experience partnering exclusively with the ambitiously bold. We craft custom brands, websites, and content for companies who dare to be different.",Entry level,Contract,Advertising Services,"Design, Art/Creative, and Information Technology",3878759664,"Encinitas, CA",Graphic Designer,CONTRACT
55264833,"Job Description

Primary task consist of entering data into the system . Entering line items into procurement database ( part numbers , descriptions , quantities , prices) E-mailing vendors to request price and availability for those line items . Communicating with vendors via e-mail & telephone - Saving Vendor quotes & other documents onto our server - Printing documents for our hard copy files - Must be bilingual . Ability to perform filing , copying, scanning and other miscellaneous clerical task . Ability to multi-task in a very fast paced environment . Must be proficient in Microsoft Outlook , Word , and Excel . Excellent Keyboarding skills .



RCS Personnel is a staffing company who works with customers seeking to fill their skilled, light industrial and administrative positions. We offer terms from temporary, temp-hire & direct hires. Visit one of our branches to see how we can assist you.

RCS Personnel is a staffing company who works with customers seeking to fill their skilled, light industrial and administrative positions. We offer terms from temporary, temp-hire & direct hires. Visit one of our branches to see how we can assist you.",Entry level,Full-time,Human Resources Services,Administrative,3878747716,"Personnel Houston, TX",Data Entry Clerk,FULL-TIME
35230,"Job Description

JOB SUMMARY

The Engineering Manager will oversee and coordinate the daily operations of highly skilled engineering staff while ensuring that company objectives and goals are met.







The incumbent be able to:









The Engineering Manager has the responsibility and commensurate authority to accomplish the following duties:



:







Equal Opportunity Employer



Adhere to all organizational information security policies and protect all sensitive information in accordance with organizational policy, Federal, State, and local regulations.







Salcomp is the world leading charger manufacturer and has provided close to 4 billion units of mobile phone chargers for our customers in the past 3 decades. It is also world’s preeminent Complex Electronics Manufacturing Services (EMS) provider. We are committed to providing our global customers with innovative solutions for their electrical manufacturing and services.

Salcomp Energy USA is a new subsidiary in the US that focuses on manufacturing of green energy products. The facility will be equipped with advanced manufacturing processes and equipment. We strive to make the world a clean and better place to live.

Salcomp Energy USA provides excellent working environment with competitive compensation package and excellent career future for our people

Salcomp is the world leading charger manufacturer and has provided close to 4 billion units of mobile phone chargers for our customers in the past 3 decades. It is also world’s preeminent Complex Electronics Manufacturing Services (EMS) provider. We are committed to providing our global customers with innovative solutions for their electrical manufacturing and services. Salcomp Energy USA is a new subsidiary in the US that focuses on manufacturing of green energy products. The facility will be equipped with advanced manufacturing processes and equipment. We strive to make the world a clean and better place to live. Salcomp Energy USA provides excellent working environment with competitive compensation package and excellent career future for our people",Mid-Senior level,Full-time,"Appliances, Electrical, and Electronics Manufacturing",Engineering and Information Technology,3878758362,"Plc Arlington, TX",Engineering Manager Manufacturing,FULL-TIME
78380425,"Job Description

We are seeking a Fine Art Painter with experience of various techniques.

Strong Experience With Acrylic Is a Major Plus.













Michael Godard is known as the explosive “Rockstar of the Art World” and global top selling artist!

His world of art invites us to see his lighthearted perspective, surrounding us with animated olives, grapes, and dancing strawberries. His unique portrayal of fun is an exciting combination of imagination and subtle humor, evoking the creative side in “Olive” us. He has redefined art as we know it and, of course, given it a punch line.

His paintings are thought provoking and full of enigmatic illusion. They show pain, love, conflict, and success, making people smile, laugh, reminisce, and exclaim, “Oh My God..ard!”

Michael Godard is known as the explosive “Rockstar of the Art World” and global top selling artist! His world of art invites us to see his lighthearted perspective, surrounding us with animated olives, grapes, and dancing strawberries. His unique portrayal of fun is an exciting combination of imagination and subtle humor, evoking the creative side in “Olive” us. He has redefined art as we know it and, of course, given it a punch line. His paintings are thought provoking and full of enigmatic illusion. They show pain, love, conflict, and success, making people smile, laugh, reminisce, and exclaim, “Oh My God..ard!”",Entry level,Full-time,Artists and Writers,"Design, Art/Creative, and Information Technology",3878753993,"Godard Fine Art Associates Las Vegas, NV",FINE ART PAINTER,FULL-TIME
165138,"Job Description

Overview:

Nelson Mullins, AMLaw 100, is seeking a Director of Marketing to join its team in Atlanta GA, Columbia SC, Charlotte NC or Greenville SC offices. As the Director of Marketing, you will play a pivotal role in shaping the brand identity and fostering business development initiatives for our firm. Reporting directly to the Chief Operations Officer, you will oversee all aspects of marketing, communication, and public relations, both internally and externally. Collaboration with internal stakeholders, including Chiefs, Directors, Committees, and Firm Leaders will be essential to align marketing efforts with overall business objectives.

You demonstrate a cohesive blend of creativity, strategic innovation, and project management skills while leading a team of 20-50 employees including Videographers, Graphic Designers, Event Planners, and Communication Specialists.



The Director of Marketing will lead the department and regularly engage with firm leadership to coordinate marketing efforts. This position requires a dynamic individual with a proven track record in marketing and public relations, capable of driving brand growth and fostering client relationships in a fast-paced environment. Drawing upon your experience, you will develop annual department goals, budgets, and marketing plans to drive the firm's growth agenda forward.

Within the Marketing Department, the Director will manage firm communications, technology applications, social media platforms, and the firm website.

The marketing department is responsible for event planning, firm retreats, client events, and tradeshows. Planning involves budget management, vendor contractor negotiations, organizing logistics, and event personnel.

In your capacity as Director, you will lead efforts to develop and execute comprehensive brand positioning strategies across firm, practice, industry, and office levels. Your expertise will be instrumental in crafting and implementing marketing campaigns tailored to specific target audiences through various mediums. Additionally, you will manage public relations activities, including media relations, interview coordination, submissions, and client/partner surveys.



The ideal candidate for this role will possess a bachelor’s degree in a relevant field and a minimum of 10 years of experience in marketing and public relations, with a focus on strategic planning and execution. Strong project management skills, excellent written and oral communication abilities, and proficiency in Microsoft Office applications and marketing tools such as CRM systems and social media platforms are essential.

Pay range for this role, with final offer amount dependent on experience: $225,000 to $275,000 (annually). Employees in this role will have the option to elect various benefits, including medical, dental, vision, accidental death and dismemberment, life insurance, dependent life insurance, long term disability, long-term care insurance, health savings accounts (if enrolled in an HDHP), health/dependent care spending accounts, 401(k).



With over 1,000 attorneys and professionals, Nelson Mullins has strong roots in the business community and an appreciation for new directions in the business world. As a Firm, Nelson Mullins has a strong foundation of community service and good citizenship. Our administrative professionals likewise promote these values, with opportunities to participate and play roles in various pro bono and community service initiatives. We collaborate with each other and with our clients, working side-by-side toward shared goals.

With over 1,000 attorneys and professionals, Nelson Mullins has strong roots in the business community and an appreciation for new directions in the business world. As a Firm, Nelson Mullins has a strong foundation of community service and good citizenship. Our administrative professionals likewise promote these values, with opportunities to participate and play roles in various pro bono and community service initiatives. We collaborate with each other and with our clients, working side-by-side toward shared goals.",Director,Full-time,Law Practice,Marketing and Sales,3878753349,"Mullins Riley & Scarborough Charlotte, NC",Director of Marketing,FULL-TIME
103113550,"Description:

A Coordinator plays a pivotal role in ensuring exceptional customer experiences for travelers. This multifaceted position combines customer service expertise with travel coordination skills to facilitate seamless and enjoyable journeys for clients. The following responsibilities and qualifications are typically associated with this role:

















Passion and the right skill set are all we're looking for. We offer in-depth training and mentorship, positioning you for success as a standout entrepreneur. Explore this exceptional business opportunity. We provide industry-leading travel commissions that are among the most competitive in the field, If you are ready to take off with a dynamic team, we'd love to hear from you!

Powered by JazzHR

z39TwiwYwB",Entry level,Full-time,Internet Publishing,Other,3878756953,Consulting United States,Entry Level-Coordinator (Remote),FULL-TIME
99375206,"This is a remote position.

Junior React Developer (1 year experience, remote)

Be part of our future! This job posting builds our talent pool for potential future openings. We'll compare your skills and experience against both current and future needs. If there's a match, we'll contact you directly. No guarantee of immediate placement, and we only consider applications from US/Canada residents during the application process.

Full-Time

$59K-$69K Per Annum.

Responsibilities:



Requirements:",Entry level,Full-time,Software Development,Information Technology,3878778128,"Remotely Inc Detroit, MI",Junior React Developer,FULL-TIME
689474,"Job Description

Hello there. We are a jersey Mike's Franchisee in the Charlotte market with 14 + locations. Looking for a great GM that can become an Operating Partner. Please reply if you are interested. Total compensation can start at around $60,000 and go up to $100,000 depending on experience and tenure.

As a GM you are only required to close 2 times a week. We close at 9 pm and the closing team gets out around 9:45 pm. Your other shifts usually are 8 am until 3 or 4 pm. Your workweek consists of around 50 hours.

Store Locations Include Charlotte, Matthews, Mint Hill, Ballantyne, Indian Trail, Waxhaw, and Weddington.



We are a growing company with 17 locations in the Charlotte area with lots of room for advancement. We have several team members that started off as hourly team members that are not Operating Partners in their own stores.

We are a growing company with 17 locations in the Charlotte area with lots of room for advancement. We have several team members that started off as hourly team members that are not Operating Partners in their own stores.",Mid-Senior level,Full-time,Restaurants,Management and Manufacturing,3878764568,"Mike's Subs Charlotte, NC",General Manager (GM),FULL-TIME
577575,"Job Description

Salary: $130,000

Do you envision working for a dynamic, mission-driven organization which supports the community while fostering an employee culture of appreciation and fun? If your answer is yes, then an employment opportunity at Directions for Living may be a great fit for you! We offer an excellent salary and benefits package to include employer paid health insurance premiums for all full-time employees, PTO and paid company holidays, 403b retirement, EAP, and year-round employee wellness and appreciation initiatives.



Reporting to the President & Chief Executive Officer (CEO), the Vice President of Finance will be responsible for the management and leadership of the Finance, Revenue Management and Information Technology departments; as well as all accounting functions, cash management, contract management, budget leadership and coordinator of the annual audit. The VP of Finance will set the organizations financial policy and direction while also being an active participant in, and driver of, the organizations overall strategy. As a member of the executive leadership team, the VP of Finance will work closely with the VP of Strategic Initiatives.

The VP of Finance will be responsible for filling the Financial Leadership function for a mid to large size not for profit organization with several healthcare operating units.

This position directly supervises the Director of Finance.













EOE/ADA/DFW

Smoke Free Campus



Our mission is to be a welcoming and compassionate provider, advocate, and partner to children, adults, and families in need of integrated healthcare, social support, safety, and hope for the future.

Thriving children. Empowered adults. Strong families.

Our mission is to be a welcoming and compassionate provider, advocate, and partner to children, adults, and families in need of integrated healthcare, social support, safety, and hope for the future. Thriving children. Empowered adults. Strong families.",Executive,Contract,Mental Health Care,Finance and Sales,3878757069,"for Living Clearwater, FL",Vice President of Finance,CONTRACT
103118769,"Are you adept at juggling multiple details and thrive in creating well-organized itineraries? We're seeking a Remote Travel Scheduling Assistant to join our team. If you have a passion for precision, excellent organizational skills, and enjoy crafting seamless travel plans, this is the perfect opportunity for you.



As a Remote Travel Scheduling Assistant, you will play a crucial role in coordinating and organizing travel schedules for our clients. Your responsibilities will include:








Powered by JazzHR

UDdqBYR1S9",Entry level,Full-time,Internet Publishing,Management and Manufacturing,3878760233,"Yes Atlanta, GA",Scheduling Assistant,FULL-TIME
2086634,"Job Description

Primary duties:











Full-time position, Day Shift, Signing Bonus



Docufree is a leading enterprise information management and business process as a service provider specializing in cloud based intelligent document management, workflow and electronic signature applications for human capital management, accounts payable, and digital mailroom. Docufree’ award winning SaaS platform has a strong presence in the Legal, Financial Services, Healthcare and Manufacturing industries and we’re expanding into other adjacent markets.

Docufree is a leading enterprise information management and business process as a service provider specializing in cloud based intelligent document management, workflow and electronic signature applications for human capital management, accounts payable, and digital mailroom. Docufree’ award winning SaaS platform has a strong presence in the Legal, Financial Services, Healthcare and Manufacturing industries and we’re expanding into other adjacent markets.",Entry level,Full-time,IT Services and IT Consulting,Administrative,3878755793,"Las Vegas, NV",Mail Processor (Signing Bonus $$$),FULL-TIME
