company_id,description,formatted_experience_level,formatted_work_type,industries,job_function,job_id,location,title,work_type
8956880,"We are seeking a highly organized and detail-oriented individual to join our team as a Travel Coordinator. In this role, you will be responsible for coordinating and organizing all aspects of your client's travel needs, including booking flights, hotels, and rental cars. Your ultimate goal will be to keep clients satisfied and loyal for future services.

Key Responsibilities:

Coordinate and book travel arrangements for clients, including flights, hotels, and rental cars

Work with travel vendors to secure the best rates and options for company travel

Monitor changes in travel policies and procedures and ensure compliance

Respond to clients inquiries and resolve any travel-related issues

Qualifications:

Must be at least 18 years of age, and be authorized to work within the US.

Must be able to effectively communicate with clients

Strong organizational skills and attention to detail

Excellent communication and interpersonal skills

Personal travel experience is a huge plus, however not required

Previous experience in customer service or hospitality also a plus, but not required

Flexibility to work in a fast-paced environment

Benefits:

Set Your Own Schedule/Flexible Schedule

Work Fully Remotely

Discounted travel and Theme Park Tickets

Discounted Cruises

All Training Provided

Work for Yourself but never by Yourself

Powered by JazzHR

w2lCHXacl4",Entry level,Full-time,Internet Publishing,Management and Manufacturing,3878437367,"NETWORKS LIMITED Atlanta, GA",Remote Travel Coordinator,FULL-TIME
71904349,"Are you an Architectural Designer in Raleigh, North Carolina looking to work with a top company in the Triangle? Apply right here!

Description:

The candidate will assist with the production of architectural drawings and will partner with a more experienced project architect to develop plans, elevations, RCPs and details. With their vision and expertise, the candidate will model spaces, usually working off redlines or getting direction in a meeting.







Experience in Healthcare, Education, and S&T sectors



Entry Level (3-5 years)



Actalent is a global leader in engineering and sciences services and talent solutions. We help visionary companies advance their engineering and science initiatives through access to specialized experts who drive scale, innovation and speed to market. With a network of almost 30,000 consultants and more than 4,500 clients across the U.S., Canada, Asia and Europe, Actalent serves many of the Fortune 500.



At Actalent, diversity and inclusion are a bridge towards the equity and success of our people. DE&I are embedded into our culture through:



The company is an equal opportunity employer and will consider all applications without regard to race, sex, age, color, religion, national origin, veteran status, disability, sexual orientation, gender identity, genetic information or any characteristic protected by law.

If you would like to request a reasonable accommodation, such as the modification or adjustment of the job application process or interviewing process due to a disability, please email actalentaccommodation@actalentservices.com for other accommodation options.",Entry level,Full-time,Business Consulting and Services,"Design, Art/Creative, and Information Technology",3878409486,"Raleigh, NC",Architectural Designer,FULL-TIME
50625,"For more than 20 years, PointClickCare has been the backbone of senior care. We’ve amassed the richest senior care dataset making our market density untouchable and our connections to the healthcare ecosystem exponentially more powerful than those of any other platform.

With Collective Medical & Audacious Inquiry, we’ve become the most expansive, full-continuum care collaboration network, offering care teams immediate, point-of-care access to deep, real-time insights at every stage of a patient’s journey.

For more information on PointClickCare, please connect with us on Glassdoor and LinkedIn.

Are you a Customer Operations Professional working in Healthcare, SaaS, or Enterprise Software and feel PointClickCare may be the place for you?! Working at PointClickCare goes beyond the resume, because the work we perform makes a true difference in people’s lives. We build innovative healthcare technology for seniors and their caregivers that improve their quality of life and well-being on a daily basis. We believe work is so much more meaningful when you’re doing it with a higher purpose.

Just because we don’t have any positions posted currently that fit your skills and experience doesn’t mean that we aren’t interested. We are always looking for the best and brightest and would love the opportunity to keep you informed about our most recent positions being posted and exciting information about PointClickCare.

Some of the key areas we are expanding in are:



If you are as passionate as we are about Healthcare and making a positive difference in people’s lives, please join us here and we look forward to getting know you!

For more information on PointClickCare please visit us on Glassdoor and LinkedIn

It is the policy of PointClickCare to ensure equal employment opportunity without discrimination or harassment on the basis of race, religion, national origin, status, age, sex, sexual orientation, gender identity or expression, marital or domestic/civil partnership status, disability, veteran status, genetic information, or any other basis protected by law. PointClickCare welcomes and encourages applications from people with disabilities. Accommodations are available upon request for candidates taking part in all aspects of the selection process. Please contact recruitment@pointclickcare.com should you require any accommodations.

When you apply for a position, your information is processed and stored with Lever, in accordance with Lever’s Privacy Policy. We use this information to evaluate your candidacy for the posted position. We also store this information, and may use it in relation to future positions to which you apply, or which we believe may be relevant to you given your background. When we have no ongoing legitimate business need to process your information, we will either delete or anonymize it. If you have any questions about how PointClickCare uses or processes your information, or if you would like to ask to access, correct, or delete your information, please contact PointClickCare’s human resources team: recruitment@pointclickcare.com

PointClickCare is committed to Information Security. By applying to this position, if hired, you commit to following our information security policies and procedures and making every effort to secure confidential and/or sensitive information.",Entry level,Full-time,Software Development,Other,3875887427,United States,Customer Operations - Talent Community,FULL-TIME
3675144,"Guesty is the all-in-one platform for hospitality businesses to automate and optimize every aspect of their operations. With purpose-built technology, industry-wide expertise, and an R&D team of 200+ engineers, Guesty ensures that hospitality businesses can streamline and achieve growth, while delivering the best value to guests. With a complete suite of features and 150+ industry partners, including major booking OTAs like Airbnb, Vrbo, Booking.com, Tripadvisor, Expedia, Hopper, Google Travel, and many more, Guesty is transforming the hospitality industry with innovative solutions.",Mid-Senior level,Full-time,"Technology, Information and Media",Information Technology,3875898609,United States,Customer Success Manager (SMB),FULL-TIME
101701751,"Job Title: Front Desk Receptionist

Company: Vegas Venture Planners

Location: Remote

Vegas Venture Planners is a premier travel agency specializing in crafting unforgettable experiences for clients in Las Vegas and beyond. Our dedication to excellence and personalized service sets us apart in the industry. As we expand our remote operations, we are seeking a friendly and professional Remote Front Desk Receptionist to join our team and be the welcoming face of our agency.

As a Remote Front Desk Receptionist, you will be the first point of contact for our clients, providing exceptional customer service and administrative support. You will play a vital role in creating a positive and memorable experience for our clients from the moment they reach out to us, whether by phone, email, or live chat.













If you are personable, organized, and passionate about travel, we want to hear from you! Please submit your resume and a cover letter outlining your relevant experience and why you are interested in joining Vegas Venture Planners as a Remote Front Desk Receptionist.

Powered by JazzHR

MDWwWNZeer",Entry level,Full-time,Internet Publishing,Administrative,3878630544,Venture Planners United States,Front Desk Receptionist,FULL-TIME
101701751,"Job Title: Virtual Customer Care Specialist

Company: Vegas Venture Planners

Location: Remote

As a Customer Care Representative, you will be the primary point of contact for our clients, providing them with outstanding service and support throughout their travel experience. Whether assisting with booking inquiries, resolving issues, or offering recommendations, you will play a crucial role in ensuring our clients have a seamless and memorable trip.













Powered by JazzHR

mYqzuEemSD",Entry level,Full-time,Internet Publishing,Other,3878629552,Venture Planners United States,Virtual Customer Care Specialist,FULL-TIME
76990402,"Comhar

Welcome to a unique opportunity that enables you to work from home and access a range of data entry research panelist positions. Our work from home data entry research panelist positions are ideal for individuals who are seeking part-time or full-time engagements or looking to diversify their career journey. Our remote positions are suitable for individuals from diverse professional backgrounds, including administrative assistants, data entry clerks, customer service representatives, or even drivers.

Regardless of your prior experience, we are here to connect you with companies that are ready to onboard you for remote work from the comfort of your own home. This exciting opportunity enables you to choose between full-time commitment and flexible part-time arrangements, all within a variety of fields that align with your interests.

We believe that genuine work-from-home data entry jobs are designed to leverage your skill set, and training will always be provided to complement the specific role you are applying for. You will find yourself earning between $30 to $45 per hour for single-session studies and up to an impressive $2,000 for multi-session studies, which is a testament to the rewards that come with this opportunity.

To embark on this journey, all you need is a computer with internet access and a tranquil workspace that shields you from distractions. Your ability to work independently and follow instructions without immediate supervision is key. While previous data entry or administrative experience is not mandatory, it could certainly be a bonus!

We welcome individuals from all backgrounds, including those with experience in healthcare, warehousing, deliveries, customer service, or any other realm. Your diversity enriches our team, and we are committed to providing a welcoming environment where you can grow and develop your skills.

You will need a laptop with a steady internet connection, and your webcam may come into play for certain studies (with extra rewards!). We are rooting for your data entry skills - reading, writing, following directions, and typing a minimum of 25 words per minute. If you have a background in customer service, administrative assistance, sales, or sales support, that's great, but it is not mandatory.

This opportunity enables you to participate in online or in-person discussions from the comfort of your own home, eliminating the need for tiresome commutes. You can set your own pace and choose whether you opt for part-time or full-time engagement. We look forward to welcoming you to our team and embarking on an exciting journey together.

Sector: Medical/Hospital

Role: Human Resources

Career level: Entry Level",Entry level,Full-time,Hospitals and Health Care,Administrative,3878612163,"Philadelphia, PA",Data Entry Clerk - No Experience (Remote),FULL-TIME
101701751,"Job Title: Customer Care Representative

Company: Vegas Venture Planners

Location: Remote

Vegas Venture Planners is a leading travel agency dedicated to curating unforgettable experiences for our clients in Las Vegas and beyond. From luxury accommodations to thrilling excursions, we strive to provide exceptional service and create lasting memories. As we continue to grow, we are seeking a passionate Remote Travel Customer Service Representative to join our team and assist our clients with their travel needs.

As a Customer Care Representative, you will be the primary point of contact for our clients, providing them with outstanding service and support throughout their travel experience. Whether assisting with booking inquiries, resolving issues, or offering recommendations, you will play a crucial role in ensuring our clients have a seamless and memorable trip.













If you are customer-focused and passionate about travel, we want to hear from you! Please submit your resume and a cover letter outlining your relevant experience and why you are interested in joining Vegas Venture Planners as a Remote Travel Customer Service Representative.

Powered by JazzHR

Ff9C1wnWTG",Entry level,Full-time,Internet Publishing,Other,3878627706,Venture Planners United States,Customer Care Representative,FULL-TIME
103113550,"Join us as a Virtual Travel Booking Assistant, where your main task revolves around ensuring travelers have a seamless and memorable journey. Embrace remote work and utilize digital tools to assist clients with their travel arrangements.

















Powered by JazzHR

MdIpWeiTcc",Entry level,Full-time,Internet Publishing,"Design, Art/Creative, and Information Technology",3878628518,"Consulting Virginia, United States",Virtual Booking Assistant-ENTRY LEVEL (Remote),FULL-TIME
2459959,"About Our Company:

At Infinx, we are a dynamic and rapidly expanding company dedicated to providing innovative technology solutions and services tailored to our clients' needs. Our mission is to collaborate closely with healthcare providers, leveraging automation and intelligence to overcome revenue cycle challenges and enhance reimbursements for patient care. We work diligently to ensure that our clients receive their revenue on time, every time. Our clientele includes physician groups, hospitals, pharmacies, and dental groups.

We are in search of experienced associates and partners who exude confidence and possess expertise in areas aligned with our clients' requirements. We value individuals who are passionate about assisting others, adept at finding solutions to challenges, and committed to improving patient care while maximizing revenue. Inclusivity and diversity are at the core of our values, fostering a workplace where employees feel a sense of belonging, their contributions are valued, and diverse perspectives are celebrated. We believe in the power of human connection, with inclusion as the heart of our mission.

Hybrid – Woodlands/Spring TX



As a Recruiting Specialist, it’s your responsibility to engage with job seekers and find the best-qualified potential employees so that we can meet and exceed our hiring goal on schedule.

You must possess the skills to help establish recruiting goals, then use those goals as benchmarks for measuring recruitment success. You will need to identify candidates using many sources – social media, web searches, internal transitions, job boards, referrals from your personal contacts, and industry associations. You will also coordinate with external recruiting sources and help lead the hiring process for candidates while coordinating and communicating interview process status with key stakeholders.











Joining Infinx comes with an array of benefits, flexible work hours when possible, and a genuine sense of belonging to a dynamic and growing organization.



If you are a dedicated and experienced Recruiting Specialist ready to contribute to our mission and be part of our diverse and inclusive community, we invite you to apply and join our team at Infinx.

Powered by JazzHR

QfyPEaOB68",Mid-Senior level,Full-time,Internet Publishing,Human Resources,3878636289,"The Woodlands, TX",Recruiting Specialist,FULL-TIME
91573107,"Embark on a rewarding journey with our unique remote business opportunity tailored for enthusiasts of exploration and individuals passionate about making meaningful connections. Join our dynamic team to venture into a realm where you can indulge your love for discovery while extending a helping hand to others.













Join us today to embark on a fulfilling journey where your passion for exploration meets your desire to assist others, all while enjoying the freedom and flexibility of a remote work environment. Unlock new opportunities and create unforgettable experiences for yourself and those you serve.

Powered by JazzHR

MrE1sqZGTH",Entry level,Full-time,Internet Publishing,Management and Manufacturing,3878630324,Moore Today United States,Event Booking Director,FULL-TIME
3281271,"We are looking for a smart, driven, and detail-oriented Merchandising Assistant who wants to join our team in New York and dive in and learn the nuts and bolts of merchandising. This is an entry level position. This person is responsible for implementing and executing product set up information for Zola vendors, and l manage set-up, purchase orders, images, and pricing in a timely and accurate fashion to maximize sales and help achieve financial objectives. The ideal candidate will have at least one year of experience in e-commerce, retail or merchandising as well as a strong desire to gain the technical and practical knowledge required to launch a career in buying. This person will work closely with all members of the Merchandising Team, and have exposure to all facets of the company including cross-functional partners in Planning, Operations, Marketing, and more.









The salary for this position is $45,000-$50,000





We're Zola, the wedding company that will do anything for love. We're reinventing the wedding planning and registry experience to make the happiest moment in our couples’ lives even happier. From engagement to wedding and decorating your first home, Zola is there, combining compassionate customer service with modern tools and technology… all in the service of love.

We built our entire platform from the ground-up in 2013, and quickly became the fastest-growing wedding company in the country. Our team has deep experience creating award-winning online and mobile products that are helpful, intuitive, and simply magical. We’re proud to have investor partners including Female Founders Fund, Comcast Ventures, Goldman Sachs, Canvas Ventures, Thrive Capital and Lightspeed Venture Partners, among others.

We are passionate about supporting all forms of love, and we’re proud of our thriving community of over 1 million couples. We strive to hire a team that is as beautifully diverse as the couples getting married today, and we encourage individuals from every race, gender identity, age, sexual orientation, ethnicity, marital status, religion and perspective to apply. Zola will always be a place where every employee, couple, wedding guest, wedding vendor, and partner will be respected and accepted and valued.

Our headquarters are in NYC, and we have an office in Montreal. Come work with us!",Entry level,Full-time,Internet Publishing,Marketing and Sales,3878622462,"New York, United States",Merchandising Assistant,FULL-TIME
91573107,"Embark on a rewarding journey with our unique remote business opportunity tailored for enthusiasts of exploration and individuals passionate about making meaningful connections. Join our dynamic team to venture into a realm where you can indulge your love for discovery while extending a helping hand to others.













Join us today to embark on a fulfilling journey where your passion for exploration meets your desire to assist others, all while enjoying the freedom and flexibility of a remote work environment. Unlock new opportunities and create unforgettable experiences for yourself and those you serve.

Powered by JazzHR

WWkja8MLcA",Entry level,Full-time,Internet Publishing,"Design, Art/Creative, and Information Technology",3878623966,Moore Today United States,Online Booking Assistant,FULL-TIME
2043953,"Our well-known retail client is seeking a 3D Modeler to help with a project.

This is remote.

You will work with a casegoods/hard surface model that exists in Solidworks and be responsible for editing it per CAD and PSSR pdfs to the final dimensions. A desk that has drawers, drawer boxes, glides, feet and handles (if needed) etc.

You will then export to FBX files, A360 link, and clay renders (front, side, back, top) for review. Upon final approval, then import the file into 3ds Max to unwrap to Real World Scale.

Final delivery would be: SolidWorks Model, and .Max file and fbx file of the wrapped model





Creative Circle's Freelance Employee benefits package includes eligibility for Minimum Essential Coverage (MEC) medical plan, dental/vision/term life package, discount prescription program, critical illness, accident, tele-behavioral health, and 401(k) plan. Sick leave is provided to Candidates whose assignment work location is in a state or city subject to sick leave laws. A Minimum Value (MV) PPO medical plan, Employee Stock Purchase Plan, and paid holiday eligibility are based on length and dates of service.

Submit resume (and samples if applicable) to: mary.blackburn@jobalert.creativecircle.com

Creative Circle is an Equal Employment Opportunity Employer. All qualified applicants will receive consideration for employment without regard to race, color, creed, religion, sex (including pregnancy, childbirth, breastfeeding, or related medical conditions), age, sexual orientation, gender identity or expression, national origin, ancestry, citizenship, genetic information, registered domestic partner status, marital status, disability, status as a crime victim, protected veteran status, or any other characteristic protected by law. Creative Circle will consider qualified applicants with criminal histories in a manner consistent with the requirements of applicable law. If you need a reasonable accommodation in the application process, please contact your Recruiter (the person you'll be interviewing with) or a member of our Human Resources team to make arrangements.PDN-9baf2751-61bc-4d4e-9610-b216289fd3ef",Entry level,Part-time,Staffing and Recruiting,"Design, Art/Creative, and Information Technology",3878602754,"Diversity Network Northbrook, IL",3D Modeler,PART-TIME
101701751,"Job Title: Work From Home Receptionist

Company: Vegas Venture Planners

Location: Remote

Vegas Venture Planners is a premier travel agency specializing in crafting unforgettable experiences for clients in Las Vegas and beyond. Our dedication to excellence and personalized service sets us apart in the industry. As we expand our remote operations, we are seeking a friendly and professional Remote Front Desk Receptionist to join our team and be the welcoming face of our agency.

As a Work From Home Receptionist , you will be the first point of contact for our clients, providing exceptional customer service and administrative support. You will play a vital role in creating a positive and memorable experience for our clients from the moment they reach out to us, whether by phone, email, or live chat.













If you are personable, organized, and passionate about travel, we want to hear from you! Please submit your resume and a cover letter outlining your relevant experience and why you are interested in joining Vegas Venture Planners as a Remote Front Desk Receptionist.

Powered by JazzHR

FhLg4IamL0",Entry level,Full-time,Internet Publishing,Administrative,3878624923,"Venture Planners Denver, CO",Work From Home Receptionist,FULL-TIME
