company_id,description,formatted_experience_level,formatted_work_type,industries,job_function,job_id,location,title,work_type
1283282,"Please complete the quick application and upload your resume for future job openings and consideration at WESTconsin Credit Union. We look forward to connecting with you!

Thank you!",Mid-Senior level,Other,Financial Services,"General Business, Management, and Business Development",3878692261,"Credit Union Menomonie, WI",Resume Portal - Don't see a job that fits your qualifications now? Upload your resume!,OTHER
54909,"Job Summary

The National Soccer Hall of Fame (NSHOF) is a public-private partnership among FC Dallas, the City of Frisco, Frisco Independent School District and U.S. Soccer Federation. The NSHOF at Toyota Stadium in Frisco, Texas contains two components: The NSHOF Experience and the HOF Club.

The NSHOF Experience is a 19,350-square foot segment of the NSHOF that honors the past, while fully incorporating modern technology of the present and future including virtual reality, gesture technology and interactive digital video boards throughout to celebrate the players, veterans and builders of American soccer that have elevated the sport to where it is today. It features interactive exhibits, iconic soccer memorabilia and serves as the home for Hall of Fame induction ceremonies annually.













The Company is an equal opportunity employer and, therefore, pledges to provide equal op­por­­tunities without regard to race, color, ancestry, religion, sexual orientation, gender identity or expression, age, national origin, disability, marital status, pregnancy, veteran status, or any other protected class. This pledge applies to all employees and applicants for employment in connection with the material terms and conditions of employment, including without limita­tion: recruitment, hiring, promotions, transfers, demotions, treatment during employment, bene­fits, compensation, leave of absence, training, or terminations. Supervisors who control these actions are respon­sible for fair and equal application to all employees. It is the Company’s intention to comply with all federal and state equal opportunity laws and executive orders forbidding any type of discrim­in­a­tion against employees or applicants.

The Company is committed to maintaining an atmosphere where all employees can perform their duties free from harassment and intimidation based on race, color, ancestry, religion, sexual orientation, gender identity or expression, age, national origin, disability, marital status, pregnancy, veteran status, or any other protected class. Employees are encouraged to accept their share of responsibility for successfully carrying out this pledge.",,Full-time,Hospitality and Spectator Sports,Other,3878686199,"Dallas Frisco, TX",National Soccer Hall of Fame Experience Specialist,FULL-TIME
99429160,"We are seeking a passionate and customer-focused Remote Hospitality Specialist to join our team. As a Remote Hospitality Specialist, you will play a vital role in ensuring exceptional guest experiences by collaborating with hotels and other vendors. This remote position offers the flexibility to work from anywhere, while enjoying exciting travel perks, fostering relationships with various vendors, and benefiting from unlimited training opportunities to enhance your expertise in hospitality management.

Responsibilities:





Requirements:





Advantages:



If you are enthusiastic about delivering exceptional guest experiences, cultivating hospitality relationships, and embracing a career filled with travel perks and training opportunities, we encourage you to apply.",Entry level,Full-time,Hospitality,Advertising,3878655863,"Portland, OR",Remote Hospitality Specialist (C),FULL-TIME
2204084,"Industry: Data Analysis

Why Consider This Job Opportunity















#DataAnalysis #ExcelSkills #RemoteWork #CareerOpportunity #DataVisualization

At Talentify, we prioritize respecting candidate privacy and championing equal-opportunity employment. Central to our mission is partnering only with companies that echo this commitment. We strive to foster a fair, transparent, and secure hiring environment for all. Should you encounter any employer not adhering to these principles, please bring it to our attention immediately.

Talentify isn't the EOR for this position. Instead, our role in this specific opportunity is to link outstanding candidates with a top-tier employer.

Talentify helps candidates around the world to discover and stay focused on the jobs they want until they can complete a full application in the hiring company career page/ATS.",Mid-Senior level,Full-time,"Technology, Information and Media",Analyst,3878690976,United States,"Junior Data Analyst, Excel Experience Required - Work From Home",FULL-TIME
2204084,"Employer Industry: Start-up Company

Why Consider This Job Opportunity















#StartUpCommunity #VirtualAssistant #Entrepreneurship #WorkFromHome #SideHustle

At Talentify, we prioritize candidate privacy and champion equal-opportunity employment. Central to our mission is our partnership with companies that share this commitment. We aim to foster a fair, transparent, and secure hiring environment for all. If you encounter any employer not adhering to these principles, please bring it to our attention immediately.

Talentify is not the EOR (Employer of Record) for this position. Our role in this specific opportunity is to connect outstanding candidates with a top-tier employer.

Talentify helps candidates around the world to discover and stay focused on the jobs they want until they can complete a full application in the hiring company career page/ATS.",Entry level,Full-time,Administrative and Support Services,Customer Service,3878693897,United States,Stay-at-home Parent - Virtual Assistant,FULL-TIME
18150143,"About Transcend

Transcend is the privacy platform that makes it easy to encode privacy across your tech stack.

We believe that engineering privacy rights and making them easily accessible to the world is one of the most high-impact ways we can spend our time. That's why we're building an ambitious team that’s passionate about solving the important problems of the future and having fun while doing it. We’re backed by Accel and Index, growing fast, and are serving some of the most iconic brands in the world.

(Even if you don't see a good fit below, we'd still love to stay in touch. Email us at recruiting@transcend.io).



As the Senior Strategic Finance Manager at Transcend, you will partner with the VP of Finance and key business partners to develop budgeting and planning for all business units. You will collaborate with stakeholders across departments, share visibility into operating performance, and build towards Company goals. You will play a critical role in helping guide the strategic direction of the Company.











The people at Transcend are driven, kind and know how to balance work, life and memes. We learn from each other and have a strong support system.

You’re joining a fast growing start up, with opportunities to help define and grow the organization.

We have a strong mission to protect user privacy rights everywhere. The privacy compliance landscape is growing, and we are at the forefront of building solutions that protect user privacy rights with modern infrastructure and automation.

You will have autonomy and trust to drive initiatives from the start.

We believe that turning the principles of data privacy into exercisable human rights is one of the most high-impact ways we can spend our time, and so we're building an ambitious team that’s passionate about solving important problems and having fun while doing it.

As the best-in-class solution in a new market, Transcend is a fast-paced and exciting workplace. The product evolves quickly to meet new client needs and adapts to the rapidly advancing world of privacy law. As one of Transcend’s earliest hires, you’ll get to work on a wide array of exciting projects.



Transcend is an equal opportunity employer that values diversity, inclusion and belonging. We do not discriminate on the basis of race, religion, color, national origin, gender, gender identity or expression, sexual orientation, age, marital status, veteran status, disability status, or any other characteristic protected by law. We will consider for employment all qualified applicants with arrest and conviction records in a manner consistent with applicable law.

Our comprehensive compensation packages play a big part in how we recognize you for the impact you have on our path to bringing data rights to everyone.

For this role, the estimated annual salary ranges are below. The actual annual salary will vary based on various factors, including market and individual qualifications objectively assessed during the interview process.

The listed range below is a guideline, and the annual salary range for this role may be modified. Transcend offers attractive health benefits, equity, and perks in addition to cash compensation.



Taking Care of You and Yours ⭐



Flexible PTO 🌴



Setting You Up For Success 💳 🥐





175,000 - 200,000 USD per year(Remote - United States)",Mid-Senior level,Full-time,Software Development,Finance and Sales,3876200651,United States,Senior Strategic Finance Manager,FULL-TIME
30215,"Mills James is seeking a dynamic person to join our Pre-Professional Program as Graphic Designer in Live Events, This opportunity is ideal for those looking to jumpstart their career in this dynamic field.

This entry-level Graphic Designer position allows you to directly collaborate with experienced professionals at Mills James in the design of dynamic event based graphic content, including PowerPoint and Keynote presentations, print and digital signage, logo design, proposal creation and the operation of presentations for live events. As part of our team, you'll acquire practical skills in visual storytelling and technical know-how, while contributing to diverse projects that tell engaging stories.

The provides recent college graduates an opportunity to obtain on-the-job work experience in preparation for a career in the communications and production industry. During the six-month session, often called the ""audition"" period, you will be expected to work 30-40 hours per week. Your skill sets need not cover the full range required for full-time associates. Displaying initiative and a willingness to learn will help you get the most out of your time in the program and add to your value in the marketplace.

At the sole discretion of Mills James, Pre-Pro associates who demonstrate outstanding skills and qualities may be offered the opportunity to continue in the program for a second six-month session. However, an individual's participation in the program will not extend beyond one year or guarantee a full-time position.







To perform this job successfully, an individual must be able to satisfactorily perform each essential duty and other duties that may be assigned. The requirements listed below are representative of the knowledge, skill, and/or ability required. Reasonable accommodations may be made to enable individuals with disabilities to perform the essential functions.



— Mills James offers the following benefits for this Pre-Professional experience - paid sick-time and holidays, 401(k) with company match",Entry level,Full-time,Media Production,"Design, Art/Creative, and Information Technology",3875875549,"James Hilliard, OH",GRAPHIC DESIGNER - PRE-PROFESSIONAL PROGRAM,FULL-TIME
2204084,"Employer Industry: Business Process Outsourcing

Why Consider This Job Opportunity















#DataEntry #WorkFromHome #CareerGrowth #CompetitivePay #RemoteWork

At Talentify, we prioritize candidate privacy and champion equal-opportunity employment. Central to our mission is our partnership with companies that share this commitment. We aim to foster a fair, transparent, and secure hiring environment for all. If you encounter any employer not adhering to these principles, please bring it to our attention immediately.

Talentify is not the EOR (Employer of Record) for this position. Our role in this specific opportunity is to connect outstanding candidates with a top-tier employer.

Talentify helps candidates around the world to discover and stay focused on the jobs they want until they can complete a full application in the hiring company career page/ATS.",Entry level,Full-time,Administrative and Support Services,Administrative,3878697144,United States,Data Entry Associate,FULL-TIME
102606001,"At our client, we are seeking a dynamic individual to join the team as the Head of Corporate Development. In this role, you will spearhead our client&#39;s M&A strategies and initiatives, driving forward their vision for growth and expansion. Working closely with the leadership team, you will play a pivotal role in identifying, negotiating, and executing key transactions that align with strategic objectives.",Director,Full-time,"Technology, Information and Internet",Business Development and Strategy/Planning,3878692308,Company Jobs United States,Head of Corporate Development,FULL-TIME
81493770,"Are you a retail, hospitality, or restaurant professional looking to transition your skills into the exciting world of event management? Join our team and leverage your customer service, organizational, and leadership experience to excel in planning and executing memorable events.



As an Event Management Associate, you'll play a vital role in coordinating and executing a wide range of events, from corporate conferences to promotional activations and community gatherings. Your background in retail, hospitality, or restaurant management will provide you with valuable skills that are directly applicable to the dynamic and fast-paced environment of event management.













Powered by JazzHR

vIp9jNusX4",Entry level,Full-time,Internet Publishing,Management and Manufacturing,3878624773,"Horizons Development St Louis, MO",Event Management: Retail/Hospitality/Restaurant Experience Wanted,FULL-TIME
17913919,"HALO Staffing Group - Immediate Interviews - Top Hospitals - Great Pay

Top rated specialty medical group in Orange County, CA has an immediate opening for an experienced Medical Surgery Scheduler. Professional Specialty practice needs a top performing Medical Surgery Scheduler that responsible for daily job duties in a medical setting.



Title: Medical Surgery Scheduler

Pay Rate: $22-23/hr DOE

Location: Orange County, CA

Schedule: Full Time, Monday-Friday 8am-5pm",Entry level,Full-time,Staffing and Recruiting,Health Care Provider,3875878038,"Staffing Group Irvine, CA",Medical Scheduler/Insurance Verification Specialist,FULL-TIME
1724109,"Savan is seeking a CUI Program Lead to support a U.S. federal civilian agency in the implementation and sustainment of its Controlled Unclassified Information Program. This client-facing position requires a candidate with a comprehensive understanding of CUI and the ability to lead policy and procedure updates, develop training, and assist with other program implementation activities. This role also requires a candidate who can effectively communicate to a variety of audiences, including senior-level management.















Hybrid Schedule

(Savan, HQ, Vienna, VA)



Submit your application to the link on this page. Applicants selected for interviews will be notified by email or phone.







Powered by JazzHR

QVcemHjA0x",Mid-Senior level,Full-time,Internet Publishing,"Consulting, Information Technology, and Sales",3878625517,"Vienna, VA",CUI Program Lead,FULL-TIME
2043953,"Our beauty client is looking for an Art Director, specialized in packaging.

This Role Is

> 40 hours per week

> 3 month contract with the potential to extend

> Urgent need

> Hybrid (3 days on site - Monday and Friday are work from home)



> 8+ years Art Director overall experience in the beauty or fashion, packaging design experience required

> Heavy, deep expertise in the packaging space with recent work showcased in a portfolio

> Advanced/Expert Apple computer skills in Adobe Creative Cloud Suite, with a specialty within Illustrator, Photoshop, and InDesign

> Comfortable with shifting design direction and working on multiple projects simultaneously in a fast-paced environment

> Eye for color and typography

> Passion for graphic design and beauty with a sense of both current and developing trends in print/pattern, art, and packaging



> Responsible for creating sustainable, inspiring, innovative package design for designated beauty brands.

> Develop original ideas and concepts that answer product briefs through multiple design solutions with consistency of being on target with objectives and brand strategy

> Review proposed designs with Design Director and SVP of Packaging prior to sharing with cross-functional teams to ensure design aesthetics and requirements are

> Drive the execution of product branding by developing and managing consistent product and packaging codes across core products, line extensions, seasonal campaigns and promotions

> Drive package design development for upcoming programs/launches on designated brands

> Partner with product development and packaging teams to achieve the highest level of quality for each project- understanding limitations due to timing, costs, etc.

> Own presentation of packaging designs to cross-functional team, including development/completion of 3D renderings and comps

> Own the translation of approved master creative compositions and lay outs into the various sizes and formats needed for products while maintaining the original creative intent and specs (including dies, bleed, trim, type safety, resolution, color mode); effectively manage files to ensure accessibility for print specs

> Act as the liaison with Senior Production Artist to ensure artwork is delivered accurately and on-time

Creative Circle's Freelance Employee benefits package includes eligibility for Minimum Essential Coverage (MEC) medical plan, dental/vision/term life package, discount prescription program, critical illness, accident, tele-behavioral health, and 401(k) plan. Sick leave is provided to Candidates whose assignment work location is in a state or city subject to sick leave laws. A Minimum Value (MV) PPO medical plan, Employee Stock Purchase Plan, and paid holiday eligibility are based on length and dates of service.

Submit resume (and samples if applicable) to: Marie.Jayme@jobalert.creativecircle.com

Creative Circle is an Equal Employment Opportunity Employer. All qualified applicants will receive consideration for employment without regard to race, color, creed, religion, sex (including pregnancy, childbirth, breastfeeding, or related medical conditions), age, sexual orientation, gender identity or expression, national origin, ancestry, citizenship, genetic information, registered domestic partner status, marital status, disability, status as a crime victim, protected veteran status, or any other characteristic protected by law. Creative Circle will consider qualified applicants with criminal histories in a manner consistent with the requirements of applicable law. If you need a reasonable accommodation in the application process, please contact your Recruiter (the person you'll be interviewing with) or a member of our Human Resources team to make arrangements.PDN-9baf2752-330e-490e-a033-27cd6a775893",Director,Part-time,Staffing and Recruiting,"Design, Art/Creative, and Information Technology",3878601737,"Diversity Network San Francisco, CA",Art Director (Packaging),PART-TIME
103118769,"As a Hotel Reservation Assistant, you will play a key role in providing exceptional customer service and facilitating hotel reservations for travelers. Your primary responsibility is to assist clients in finding suitable accommodations based on their preferences and budget, ensuring a seamless booking process. This position requires strong communication skills, attention to detail, and a customer-centric approach to deliver a positive experience for travelers.













As a Travel Hotel Reservation Assistant, you will play a vital role in helping travelers find suitable accommodations and ensuring a smooth booking process. By leveraging your communication skills, attention to detail, and customer service expertise, you will contribute to creating positive experiences for clients and enhancing their overall travel satisfaction.

Powered by JazzHR

KzVLvIWjgx",Entry level,Full-time,Internet Publishing,Management and Manufacturing,3878629469,"Yes Houston, TX",Hotel Reservation Assistant,FULL-TIME
4827017,"Upwork ($UPWK) is the world’s work marketplace. We serve everyone from one-person startups to large, Fortune 100 enterprises with a powerful, trust-driven platform that enables companies and talent to work together in new ways that unlock their potential.

Last year, more than $3.8 billion of work was done through Upwork by skilled professionals who are gaining more control by finding work they are passionate about and innovating their careers.

Upwork is seeking a passionate and driven Paid Social Specialist to join our Growth Marketing team. If you're eager to propel your career forward, drive growth through Paid Social, and thrive in a collaborative remote environment, we want to hear from you! As the Paid Social Specialist, you will join the Growth Marketing team responsible for driving growth in Job Posts, Contract Starts, and Revenue alongside a dedicated Paid Social team and Growth Marketing counterparts. In this role, you will be responsible for the execution of direct-response paid social strategies and support for complex reporting needs. Apply now to be part of our mission to shape the future of work!




















At Upwork, you’ll shape talent solutions for how the world works today. We are a remote-first organization working together to create exciting remote work opportunities for a global community of professionals. While we have physical offices in San Francisco and Chicago, currently we also support hiring of corporate full-time employees in 19 states in the United States. Please speak with a member of our recruitment team to determine whether you are located in a state in which we are hiring corporate full-time employees.

Our vibrant culture is built on shared values and our mission to create economic opportunities so that people have better lives. We foster amazing teams, put our community first, and have a bias toward action. We encourage everyone to bring their whole selves to work and grow together through development opportunities, mentorship, and employee resource groups. And oh yeah, we've also got amazing benefits - including medical insurance for you and your family, unlimited PTO, 401(k) with matching, 12 weeks of paid parental leave, and a generous Employee Stock Purchase Plan. Check out our Life at Upwork page to learn more about our benefits and the employee experience.

Check out our Life at Upwork page to learn more about the employee experience.

Upwork is proudly committed to recruiting and retaining a diverse and inclusive workforce. As an Equal Opportunity Employer, we never discriminate based on race, religion, color, national origin, gender (including pregnancy, childbirth, or related medical condition), sexual orientation, gender identity, gender expression, age, status as a protected veteran, status as an individual with a disability, or other applicable legally protected characteristics.



Total Annual Compensation

$85,250—$115,250 USD

To learn more about how Upwork processes and protects your personal information as part of the application process, please review our Global Job Applicant Privacy Notice",Associate,Full-time,"Technology, Information and Internet and Human Resources Services",Other,3878610432,"Maryland, United States",Paid Social Specialist,FULL-TIME
